{
  "$id": "https://posthog-impact.local/schemas/feature_flags.schema.json",
  "$schema": "https://json-schema.org/draft/2020-12/schema",
  "additionalProperties": false,
  "properties": {
    "computed_at": {
      "arrow_type": "string",
      "type": [
        "string",
        "null"
      ]
    },
    "detection": {
      "arrow_type": "string",
      "type": [
        "string",
        "null"
      ]
    },
    "diff_side": {
      "arrow_type": "string",
      "type": [
        "string",
        "null"
      ]
    },
    "evidence": {
      "arrow_type": "string",
      "type": [
        "string",
        "null"
      ]
    },
    "flag_key": {
      "arrow_type": "string",
      "type": [
        "string",
        "null"
      ]
    },
    "owner_annotation": {
      "arrow_type": "string",
      "type": [
        "string",
        "null"
      ]
    },
    "pr_id": {
      "arrow_type": "string",
      "type": [
        "string",
        "null"
      ]
    },
    "pr_number": {
      "arrow_type": "int64",
      "type": [
        "integer",
        "null"
      ]
    },
    "strength": {
      "arrow_type": "string",
      "type": [
        "string",
        "null"
      ]
    }
  },
  "title": "feature_flags",
  "type": "object",
  "x-pipeline-version": "1.0.0",
  "x-schema-version": "1.0.0"
}
