[
  {
    "computed_at": "2026-08-17T14:45:00.370801Z",
    "detection": "constant_unresolved",
    "diff_side": "added",
    "evidence": "email'     const engagementEventsAvailable = !!featureFlags[FEATURE_FLAGS.WORKFLOWS_ENGAGEMENT_EVENTS]     const engagementEventsEnabled = !!currentTeam?.workflo",
    "flag_key": "WORKFLOWS_ENGAGEMENT_EVENTS",
    "owner_annotation": null,
    "pr_id": "github.com/PostHog/posthog#pr/50122",
    "pr_number": 50122,
    "strength": "weak"
  },
  {
    "computed_at": "2026-08-17T14:45:00.413168Z",
    "detection": "constant_resolved",
    "diff_side": "added",
    "evidence": "useActions(webAnalyticsLogic)             {featureFlags[FEATURE_FLAGS.WEB_ANALYTICS_PRECOMPUTE_TOGGLE] && (                 <>                     <ScenePanelDiv",
    "flag_key": "web-analytics-precompute-toggle",
    "owner_annotation": "@lricoy",
    "pr_id": "github.com/PostHog/posthog#pr/52155",
    "pr_number": 52155,
    "strength": "strong"
  },
  {
    "computed_at": "2026-08-17T14:45:00.413171Z",
    "detection": "constant_resolved",
    "diff_side": "removed",
    "evidence": "</ButtonPrimitive>                 {featureFlags[FEATURE_FLAGS.WEB_ANALYTICS_PRECOMPUTE_TOGGLE] && (                     <Tooltip title=\"When on, eligible",
    "flag_key": "web-analytics-precompute-toggle",
    "owner_annotation": "@lricoy",
    "pr_id": "github.com/PostHog/posthog#pr/52155",
    "pr_number": 52155,
    "strength": "strong"
  },
  {
    "computed_at": "2026-08-17T14:45:00.417154Z",
    "detection": "api_literal",
    "diff_side": "removed",
    "evidence": "ce_filters(team: Team) -> bool:     return posthoganalytics.feature_enabled(         \"hogql-insights-replace-filters\",         str(team.uuid),         groups={             \"orga",
    "flag_key": "hogql-insights-replace-filters",
    "owner_annotation": null,
    "pr_id": "github.com/PostHog/posthog#pr/53793",
    "pr_number": 53793,
    "strength": "medium"
  },
  {
    "computed_at": "2026-08-17T14:45:00.438922Z",
    "detection": "constant_resolved",
    "diff_side": "added",
    "evidence": "st showTagsTab = effectiveGenerationEvent && !!featureFlags[FEATURE_FLAGS.LLM_ANALYTICS_TAGS]          // If the user is viewing the Tags tab but it's n",
    "flag_key": "llm-analytics-tags",
    "owner_annotation": "#team-ai-observability",
    "pr_id": "github.com/PostHog/posthog#pr/54592",
    "pr_number": 54592,
    "strength": "strong"
  },
  {
    "computed_at": "2026-08-17T14:45:00.447298Z",
    "detection": "constant_resolved",
    "diff_side": "added",
    "evidence": "urrentTeamId && (                     <FlaggedFeature flag={FEATURE_FLAGS.PROPERTY_ACCESS_CONTROL}>                         <SceneDivider />",
    "flag_key": "property-access-control",
    "owner_annotation": "@reecejones",
    "pr_id": "github.com/PostHog/posthog#pr/54799",
    "pr_number": 54799,
    "strength": "strong"
  },
  {
    "computed_at": "2026-08-17T14:45:00.465533Z",
    "detection": "api_literal",
    "diff_side": "added",
    "evidence": "id: str) -> bool:     return bool(         posthoganalytics.feature_enabled(             \"streamlit-apps\",             distinct_id,             groups={\"organization",
    "flag_key": "streamlit-apps",
    "owner_annotation": "@sakce",
    "pr_id": "github.com/PostHog/posthog#pr/54879",
    "pr_number": 54879,
    "strength": "medium"
  },
  {
    "computed_at": "2026-08-17T14:45:00.472712Z",
    "detection": "api_literal",
    "diff_side": "added",
    "evidence": ": JSX.Element {     const streamlitAppsFeatureFlagEnabled = useFeatureFlag('STREAMLIT_APPS')     const shortId = props.id as string     const { streaml",
    "flag_key": "STREAMLIT_APPS",
    "owner_annotation": null,
    "pr_id": "github.com/PostHog/posthog#pr/54880",
    "pr_number": 54880,
    "strength": "medium"
  },
  {
    "computed_at": "2026-08-17T14:45:00.472685Z",
    "detection": "constant_resolved",
    "diff_side": "added",
    "evidence": "category: ProductItemCategory.UNRELEASED,         flag: FEATURE_FLAGS.STREAMLIT_APPS,         iconType: 'tools',         iconColor: ['var(--colo",
    "flag_key": "streamlit-apps",
    "owner_annotation": "@sakce",
    "pr_id": "github.com/PostHog/posthog#pr/54880",
    "pr_number": 54880,
    "strength": "strong"
  },
  {
    "computed_at": "2026-08-17T14:45:00.478789Z",
    "detection": "api_literal",
    "diff_side": "added",
    "evidence": "g.conversion_goal_precomputation_enabled = posthoganalytics.feature_enabled(             \"marketing-analytics-precomputation\",             str(team.uuid),             groups={\"organizat",
    "flag_key": "marketing-analytics-precomputation",
    "owner_annotation": null,
    "pr_id": "github.com/PostHog/posthog#pr/55005",
    "pr_number": 55005,
    "strength": "medium"
  },
  {
    "computed_at": "2026-08-17T14:45:00.542644Z",
    "detection": "constant_resolved",
    "diff_side": "added",
    "evidence": "within the rollout percentage.             {!!featureFlags[FEATURE_FLAGS.FEATURE_FLAG_EARLY_EXIT] && !hideEarlyExit && (                 <div className=\"fle",
    "flag_key": "feature-flag-early-exit",
    "owner_annotation": "@gustavo",
    "pr_id": "github.com/PostHog/posthog#pr/57321",
    "pr_number": 57321,
    "strength": "strong"
  },
  {
    "computed_at": "2026-08-17T14:45:00.738980Z",
    "detection": "api_literal",
    "diff_side": "added",
    "evidence": "nvironment/DefaultCupedEnabled'     const showCupedOption = useFeatureFlag('EXPERIMENT_CUPED')             {showCupedOption && (                 <div>",
    "flag_key": "EXPERIMENT_CUPED",
    "owner_annotation": null,
    "pr_id": "github.com/PostHog/posthog#pr/58218",
    "pr_number": 58218,
    "strength": "medium"
  },
  {
    "computed_at": "2026-08-17T14:45:00.755456Z",
    "detection": "api_literal",
    "diff_side": "added",
    "evidence": "bs/issues/SourceMapsBanner'     const hasSourceMapsBanner = useFeatureFlag('ERROR_TRACKING_SOURCE_MAPS_BANNER')                     {hasSourceMapsBanner ? <SourceMapsBann",
    "flag_key": "ERROR_TRACKING_SOURCE_MAPS_BANNER",
    "owner_annotation": null,
    "pr_id": "github.com/PostHog/posthog#pr/58306",
    "pr_number": 58306,
    "strength": "medium"
  },
  {
    "computed_at": "2026-08-17T14:45:00.783326Z",
    "detection": "constant_resolved",
    "diff_side": "added",
    "evidence": "featureFlags[FEATURE_FLAGS.MCP_ANALYTICS]                             ? {",
    "flag_key": "mcp-analytics",
    "owner_annotation": "#project-mcp-analytics",
    "pr_id": "github.com/PostHog/posthog#pr/58407",
    "pr_number": 58407,
    "strength": "strong"
  },
  {
    "computed_at": "2026-08-17T14:45:00.793016Z",
    "detection": "constant_unresolved",
    "diff_side": "added",
    "evidence": "gLogic)     const promptExperimentsEnabled = !!featureFlags[FEATURE_FLAGS.EXPERIMENTS_LLM_PROMPTS]     const activeViewTab =         searchParams?.tab === 'u",
    "flag_key": "EXPERIMENTS_LLM_PROMPTS",
    "owner_annotation": null,
    "pr_id": "github.com/PostHog/posthog#pr/58437",
    "pr_number": 58437,
    "strength": "weak"
  },
  {
    "computed_at": "2026-08-17T14:45:00.845312Z",
    "detection": "constant_unresolved",
    "diff_side": "added",
    "evidence": "{                 featureFlagLogic.actions.setFeatureFlags([FEATURE_FLAGS.NOTEBOOKS_COLLABORATION], {                     [FEATURE_FLAGS.NOTEBOOKS_COLLABORAT",
    "flag_key": "NOTEBOOKS_COLLABORATION",
    "owner_annotation": null,
    "pr_id": "github.com/PostHog/posthog#pr/58677",
    "pr_number": 58677,
    "strength": "weak"
  },
  {
    "computed_at": "2026-08-17T14:45:00.962297Z",
    "detection": "constant_resolved",
    "diff_side": "added",
    "evidence": "lues(featureFlagLogic)     const aiEnabled = !!featureFlags[FEATURE_FLAGS.MARKETING_ANALYTICS_AI]      // Shared context for every Marketing analytics Max t",
    "flag_key": "marketing-analytics-ai",
    "owner_annotation": "@jabahamondes",
    "pr_id": "github.com/PostHog/posthog#pr/58688",
    "pr_number": 58688,
    "strength": "strong"
  },
  {
    "computed_at": "2026-08-17T14:45:01.010510Z",
    "detection": "api_literal",
    "diff_side": "added",
    "evidence": "ings.DEBUG:         return True     return posthoganalytics.feature_enabled(         \"product-business-knowledge\",         str(team.organization_id),         groups={\"organi",
    "flag_key": "product-business-knowledge",
    "owner_annotation": "@veryayskiy",
    "pr_id": "github.com/PostHog/posthog#pr/58764",
    "pr_number": 58764,
    "strength": "medium"
  },
  {
    "computed_at": "2026-08-17T14:45:01.025748Z",
    "detection": "constant_unresolved",
    "diff_side": "removed",
    "evidence": "REBUILD]     const useHeadlessAutocomplete = !!featureFlags[FEATURE_FLAGS.TAXONOMIC_FILTER_HEADLESS]     // The new picker ramps in via either flag \u2014 `useNewPi",
    "flag_key": "TAXONOMIC_FILTER_HEADLESS",
    "owner_annotation": null,
    "pr_id": "github.com/PostHog/posthog#pr/58816",
    "pr_number": 58816,
    "strength": "weak"
  },
  {
    "computed_at": "2026-08-17T14:45:01.025738Z",
    "detection": "constant_resolved",
    "diff_side": "added",
    "evidence": "ferenceLogic)     const menuRebuildEnabled = !!featureFlags[FEATURE_FLAGS.TAXONOMIC_FILTER_MENU_REBUILD]     const legacyDropdown = (         <LemonDropdown",
    "flag_key": "taxonomic-filter-menu-rebuild",
    "owner_annotation": "@adamleith",
    "pr_id": "github.com/PostHog/posthog#pr/58816",
    "pr_number": 58816,
    "strength": "strong"
  },
  {
    "computed_at": "2026-08-17T14:45:01.025746Z",
    "detection": "constant_resolved",
    "diff_side": "removed",
    "evidence": "featureFlagLogic)     const useMenuRebuild = !!featureFlags[FEATURE_FLAGS.TAXONOMIC_FILTER_MENU_REBUILD]     const useHeadlessAutocomplete = !!featureFlags[FEATURE",
    "flag_key": "taxonomic-filter-menu-rebuild",
    "owner_annotation": "@adamleith",
    "pr_id": "github.com/PostHog/posthog#pr/58816",
    "pr_number": 58816,